{
  "$schema": "https://json-schema.org/draft/2020-12/schema",
  "$id": "https://osp.dev/schemas/service-manifest.schema.json",
  "title": "ServiceManifest",
  "description": "A provider's catalog of available services, published at /.well-known/osp.json",
  "type": "object",
  "required": ["manifest_id", "manifest_version", "provider_id", "display_name", "offerings", "endpoints", "provider_signature"],
  "properties": {
    "manifest_id": {
      "type": "string",
      "description": "Unique manifest identifier",
      "pattern": "^mf_[a-z0-9_]+$"
    },
    "manifest_version": {
      "type": "integer",
      "minimum": 1,
      "description": "Monotonically increasing version number"
    },
    "previous_version": {
      "type": ["integer", "null"],
      "description": "Previous manifest version, null for first version"
    },
    "osp_spec_version": {
      "type": "string",
      "default": "1.1",
      "description": "Version of the OSP specification this manifest conforms to"
    },
    "provider_id": {
      "type": "string",
      "description": "Provider's domain or identifier (e.g., 'supabase.com')"
    },
    "display_name": {
      "type": "string",
      "description": "Human-readable provider name"
    },
    "provider_url": {
      "type": "string",
      "format": "uri",
      "description": "Provider's website"
    },
    "provider_public_key": {
      "type": "string",
      "description": "Ed25519 public key (base64url) for manifest verification"
    },
    "offerings": {
      "type": "array",
      "items": {
        "$ref": "#/$defs/ServiceOffering"
      },
      "minItems": 1,
      "description": "List of service offerings available from this provider"
    },
    "accepted_payment_methods": {
      "type": "array",
      "items": {
        "type": "string",
        "enum": ["free", "sardis_wallet", "stripe_spt", "x402", "mpp", "invoice", "external"]
      },
      "description": "Payment methods this provider accepts"
    },
    "trust_tier_required": {
      "type": "integer",
      "minimum": 0,
      "maximum": 3,
      "default": 0,
      "description": "Minimum agent trust tier to provision (0=anonymous, 1=verified, 2=bonded, 3=enterprise)"
    },
    "endpoints": {
      "$ref": "#/$defs/ProviderEndpoints",
      "description": "API endpoints for provisioning lifecycle operations"
    },
    "a2a": {
      "$ref": "#/$defs/A2AAgentCard",
      "description": "A2A agent card for delegated provisioning (v1.1)"
    },
    "nhi": {
      "$ref": "#/$defs/NHIConfig",
      "description": "Non-human identity lifecycle configuration (v1.1)"
    },
    "finops": {
      "$ref": "#/$defs/FinOpsConfig",
      "description": "FinOps budget and cost guardrails configuration (v1.1)"
    },
    "dependency_graph": {
      "$ref": "#/$defs/DependencyGraph",
      "description": "Service dependency graph metadata (v1.1)"
    },
    "scorecards": {
      "$ref": "#/$defs/Scorecards",
      "description": "Service maturity scorecards and compliance checklists (v1.1)"
    },
    "observability": {
      "$ref": "#/$defs/ObservabilityConfig",
      "description": "Agent observability and tracing configuration (v1.1)"
    },
    "mcp": {
      "$ref": "#/$defs/MCPConfig",
      "description": "MCP .well-known alignment and tool advertisement (v1.1)"
    },
    "extensions": {
      "type": "object",
      "description": "Provider-specific metadata and custom extensions"
    },
    "effective_at": {
      "type": "string",
      "format": "date-time",
      "description": "When this manifest version becomes effective (ISO 8601)"
    },
    "provider_signature": {
      "type": "string",
      "description": "Ed25519 signature over canonical JSON (excluding this field)"
    }
  },
  "$defs": {
    "ServiceOffering": {
      "type": "object",
      "required": ["offering_id", "name", "category", "tiers", "credentials_schema"],
      "description": "A single service offering within the provider's catalog",
      "properties": {
        "offering_id": {
          "type": "string",
          "pattern": "^[a-z0-9-]+/[a-z0-9-]+$",
          "description": "Unique offering ID, format: provider/service (e.g., 'supabase/postgres')"
        },
        "name": {
          "type": "string",
          "description": "Human-readable name of the service offering"
        },
        "description": {
          "type": "string",
          "description": "Detailed description of the service offering"
        },
        "category": {
          "type": "string",
          "enum": ["database", "hosting", "auth", "analytics", "storage", "compute", "messaging", "monitoring", "search", "ai", "email", "other"],
          "description": "Service category for discovery and filtering"
        },
        "tiers": {
          "type": "array",
          "items": {
            "$ref": "#/$defs/ServiceTier"
          },
          "minItems": 1,
          "description": "Available pricing/capability tiers for this offering"
        },
        "credentials_schema": {
          "type": "object",
          "description": "JSON Schema describing the credentials that will be returned upon provisioning"
        },
        "estimated_provision_seconds": {
          "type": "integer",
          "default": 30,
          "description": "Estimated time to provision in seconds"
        },
        "fulfillment_proof_type": {
          "type": "string",
          "enum": ["api_key_delivery", "health_check", "signed_receipt"],
          "default": "api_key_delivery",
          "description": "How the provider proves fulfillment after provisioning"
        },
        "regions": {
          "type": "array",
          "items": {
            "type": "string"
          },
          "description": "Available deployment regions (e.g., 'us-east-1', 'eu-west-1')"
        },
        "available_regions": {
          "type": "array",
          "items": {
            "type": "string"
          },
          "description": "Simple list of available region identifiers for quick enumeration. Complements 'regions' which may contain RegionObjects with jurisdiction metadata."
        },
        "documentation_url": {
          "type": "string",
          "format": "uri",
          "description": "URL to the service offering's documentation"
        },
        "dependencies": {
          "type": "array",
          "items": {
            "type": "string"
          },
          "description": "Other offering IDs that this offering depends on (v1.1)"
        },
        "sbom_url": {
          "type": "string",
          "format": "uri",
          "description": "URL to the SBOM (Software Bill of Materials) for this offering (v1.1)"
        },
        "canary": {
          "$ref": "#/$defs/CanaryConfig",
          "description": "Progressive deployment / canary provisioning config (v1.1)"
        }
      }
    },
    "ServiceTier": {
      "type": "object",
      "required": ["tier_id", "name", "price"],
      "description": "A pricing/capability tier within a service offering",
      "properties": {
        "tier_id": {
          "type": "string",
          "description": "Unique identifier for this tier within the offering"
        },
        "name": {
          "type": "string",
          "description": "Human-readable tier name (e.g., 'Free', 'Pro', 'Enterprise')"
        },
        "price": {
          "$ref": "#/$defs/Price",
          "description": "Pricing information for this tier"
        },
        "limits": {
          "type": "object",
          "description": "Tier-specific resource limits (storage_mb, api_calls, connections, etc.)"
        },
        "features": {
          "type": "array",
          "items": {
            "type": "string"
          },
          "description": "List of features included in this tier"
        },
        "escrow_profile": {
          "$ref": "#/$defs/EscrowProfile",
          "description": "Escrow timing parameters for paid tiers"
        },
        "rate_limit": {
          "type": "string",
          "description": "Rate limit description (e.g., '2 projects', '1000 req/min')"
        },
        "usage_metering": {
          "$ref": "#/$defs/UsageMetering",
          "description": "Usage-based billing configuration"
        },
        "sla": {
          "type": "string",
          "description": "Service Level Agreement (e.g., '99.9%', '99.99%') (v1.1)"
        },
        "ttl_seconds": {
          "type": ["integer", "null"],
          "description": "Default environment TTL in seconds, null for no expiry (v1.1)"
        }
      }
    },
    "Price": {
      "type": "object",
      "required": ["amount", "currency"],
      "description": "Pricing information with currency and optional billing interval",
      "properties": {
        "amount": {
          "type": "string",
          "pattern": "^[0-9]+(\\.[0-9]{1,2})?$",
          "description": "Price amount as string to avoid floating point precision issues (e.g., '25.00')"
        },
        "currency": {
          "type": "string",
          "enum": ["USD", "EUR", "GBP", "USDC", "EURC"],
          "description": "ISO 4217 currency code or stablecoin identifier"
        },
        "interval": {
          "type": ["string", "null"],
          "description": "Billing interval as ISO 8601 duration (P1M = monthly, P1Y = yearly), null for one-time charges"
        }
      }
    },
    "EscrowProfile": {
      "type": "object",
      "description": "Escrow timing parameters governing payment hold and release",
      "properties": {
        "timeout_seconds": {
          "type": "integer",
          "default": 3600,
          "description": "Maximum time in seconds before escrowed funds are returned if provisioning fails"
        },
        "verification_window_seconds": {
          "type": "integer",
          "default": 900,
          "description": "Time in seconds the agent has to verify provisioning before auto-release"
        },
        "dispute_window_seconds": {
          "type": "integer",
          "default": 86400,
          "description": "Time in seconds after verification during which disputes can be raised"
        }
      }
    },
    "UsageMetering": {
      "type": "object",
      "description": "Configuration for usage-based metering and billing",
      "properties": {
        "dimensions": {
          "type": "array",
          "items": {
            "type": "string"
          },
          "description": "Metered dimensions (e.g., 'storage_bytes', 'api_calls', 'compute_hours')"
        },
        "reporting_window": {
          "type": "string",
          "description": "How often usage is reported, as ISO 8601 duration (e.g., 'PT1H' for hourly)"
        },
        "countersignature_required": {
          "type": "boolean",
          "default": false,
          "description": "Whether the agent must countersign usage reports for billing"
        }
      }
    },
    "ProviderEndpoints": {
      "type": "object",
      "required": ["provision", "deprovision", "credentials", "status", "health"],
      "description": "API endpoint paths for provisioning lifecycle operations",
      "properties": {
        "provision": {
          "type": "string",
          "description": "POST endpoint path for provisioning new resources"
        },
        "deprovision": {
          "type": "string",
          "description": "DELETE endpoint path for deprovisioning resources"
        },
        "credentials": {
          "type": "string",
          "description": "GET endpoint path for retrieving current credentials"
        },
        "rotate": {
          "type": "string",
          "description": "POST endpoint path for credential rotation"
        },
        "status": {
          "type": "string",
          "description": "GET endpoint path for resource status"
        },
        "usage": {
          "type": "string",
          "description": "GET endpoint path for usage/metering data"
        },
        "health": {
          "type": "string",
          "description": "GET endpoint path for provider health checks"
        },
        "dependency_graph": {
          "type": "string",
          "description": "GET endpoint path for dependency graph (v1.1)"
        },
        "scorecard": {
          "type": "string",
          "description": "GET endpoint path for service scorecard (v1.1)"
        },
        "skills": {
          "type": "string",
          "description": "GET endpoint path for LLM skills document (v1.1)"
        }
      }
    },
    "A2AAgentCard": {
      "type": "object",
      "description": "A2A agent card enabling delegated provisioning between agents (v1.1)",
      "properties": {
        "agent_id": {
          "type": "string",
          "description": "Unique agent identifier for this provider"
        },
        "capabilities": {
          "type": "array",
          "items": {
            "type": "string",
            "enum": ["provision", "deprovision", "rotate", "monitor", "delegate"]
          },
          "description": "Agent capabilities this provider supports"
        },
        "delegation_endpoint": {
          "type": "string",
          "description": "Endpoint for receiving delegated provisioning requests from other agents"
        },
        "task_lifecycle": {
          "type": "boolean",
          "default": false,
          "description": "Whether this provider supports A2A task lifecycle states"
        },
        "agent_public_key": {
          "type": "string",
          "description": "Ed25519 public key for agent-to-agent communication (base64url)"
        }
      }
    },
    "NHIConfig": {
      "type": "object",
      "description": "Non-human identity lifecycle configuration (v1.1)",
      "properties": {
        "short_lived_tokens": {
          "type": "boolean",
          "default": false,
          "description": "Provider supports short-lived token issuance instead of static API keys"
        },
        "token_ttl_seconds": {
          "type": "integer",
          "description": "Default TTL for short-lived tokens in seconds"
        },
        "orphan_detection": {
          "type": "boolean",
          "default": false,
          "description": "Provider supports NHI inventory and orphan identity detection"
        },
        "federation": {
          "type": "array",
          "items": {
            "type": "string",
            "enum": ["oidc", "spiffe", "mtls"]
          },
          "description": "Supported identity federation protocols"
        },
        "token_endpoint": {
          "type": "string",
          "description": "Endpoint for obtaining short-lived tokens"
        }
      }
    },
    "FinOpsConfig": {
      "type": "object",
      "description": "FinOps budget guardrails and cost-as-code configuration (v1.1)",
      "properties": {
        "budget_enforcement": {
          "type": "boolean",
          "default": false,
          "description": "Provider supports budget guardrails and spend limits"
        },
        "cost_in_pr": {
          "type": "boolean",
          "default": false,
          "description": "Provider supports cost-in-PR previews for config changes"
        },
        "anomaly_detection": {
          "type": "boolean",
          "default": false,
          "description": "Provider supports cost anomaly detection and alerting"
        },
        "burn_rate_tracking": {
          "type": "boolean",
          "default": false,
          "description": "Provider supports environment burn rate tracking with TTLs"
        },
        "budget_endpoint": {
          "type": "string",
          "description": "Endpoint for budget and cost management operations"
        }
      }
    },
    "DependencyGraph": {
      "type": "object",
      "description": "Service dependency graph metadata for impact analysis (v1.1)",
      "properties": {
        "auto_generate": {
          "type": "boolean",
          "default": false,
          "description": "Provider can auto-generate dependency graph from project state"
        },
        "impact_analysis": {
          "type": "boolean",
          "default": false,
          "description": "Provider supports impact analysis before deprovision/rotate"
        },
        "health_propagation": {
          "type": "boolean",
          "default": false,
          "description": "Unhealthy service propagates warnings to dependents"
        },
        "auto_docs": {
          "type": "boolean",
          "default": false,
          "description": "Provider can auto-generate architecture documentation"
        }
      }
    },
    "Scorecards": {
      "type": "object",
      "description": "Service maturity scorecards and compliance checklists (v1.1)",
      "properties": {
        "maturity_scores": {
          "type": "object",
          "description": "Maturity scores by dimension (monitoring, backups, rotation, https, etc.)"
        },
        "compliance": {
          "type": "array",
          "items": {
            "type": "string",
            "enum": ["soc2", "hipaa", "gdpr", "pci_dss", "iso27001"]
          },
          "description": "Compliance frameworks supported by this provider"
        },
        "guided_remediation": {
          "type": "boolean",
          "default": false,
          "description": "Provider supports guided remediation via osp fix commands"
        }
      }
    },
    "ObservabilityConfig": {
      "type": "object",
      "description": "Agent observability and OpenTelemetry tracing configuration (v1.1)",
      "properties": {
        "otel_endpoint": {
          "type": "string",
          "description": "OpenTelemetry collector endpoint for sending traces"
        },
        "trace_propagation": {
          "type": "array",
          "items": {
            "type": "string",
            "enum": ["w3c", "b3", "jaeger"]
          },
          "description": "Supported trace context propagation formats"
        },
        "audit_log": {
          "type": "boolean",
          "default": false,
          "description": "Provider exposes structured queryable audit log"
        },
        "hitl_gates": {
          "type": "boolean",
          "default": false,
          "description": "Destructive operations require human-in-the-loop approval"
        },
        "cost_per_action": {
          "type": "boolean",
          "default": false,
          "description": "Provider tracks cost per agent action"
        }
      }
    },
    "MCPConfig": {
      "type": "object",
      "description": "MCP .well-known alignment and tool advertisement (v1.1)",
      "properties": {
        "tools": {
          "type": "array",
          "items": {
            "type": "string"
          },
          "description": "MCP tool names this provider exposes"
        },
        "streamable_http": {
          "type": "boolean",
          "default": false,
          "description": "Provider supports MCP Streamable HTTP transport"
        },
        "well_known_url": {
          "type": "string",
          "format": "uri",
          "description": "URL to the provider's /.well-known/mcp.json"
        },
        "skills_url": {
          "type": "string",
          "format": "uri",
          "description": "URL to the provider's LLM skills document"
        }
      }
    },
    "CanaryConfig": {
      "type": "object",
      "description": "Progressive deployment / canary provisioning configuration (v1.1)",
      "properties": {
        "enabled": {
          "type": "boolean",
          "default": false,
          "description": "Whether canary/progressive deployment is supported"
        },
        "strategies": {
          "type": "array",
          "items": {
            "type": "string",
            "enum": ["percentage", "blue_green", "rolling"]
          },
          "description": "Supported deployment strategies"
        }
      }
    }
  }
}
